fd88e8bbf5039fed7ffc7da33d1281db,Affiliate Intel,Affiliate Insider: 3 Crucial Metrics for Online Marketing http://t.co/Qj1ytoY3 by @MediaTrust
fd88e8bbf5039fed7ffc7da33d1281db,Affiliate Intel,Affiliate Insider: Come Join Us for a Smoothie! http://t.co/Cq6uP8YY by @MediaTrust
fd88e8bbf5039fed7ffc7da33d1281db,Affiliate Intel,'Affiliate Insider: Twitter, the New Midsize Dependable Dog? http://t.co/OqgT3Eob by @MediaTrust'
fd88e8bbf5039fed7ffc7da33d1281db,Ben Kneen,'@alexcalic I think industry needs a tech solution vs. a monitor &amp; enforce solution - @mediatrust great on latter, no one exists for former'
fd88e8bbf5039fed7ffc7da33d1281db,peter bordes,@newedu love to connect re partnering. we have a very large #edu #leadgen marketing channel on the @MediaTrust PerformanceExchange
fd88e8bbf5039fed7ffc7da33d1281db,Trunk Films,@mediatrust thanks for the screening and rooibos tea yesterday!
